
****** Vivado v2015.4 (64-bit)
  **** SW Build 1412921 on Wed Nov 18 09:44:32 MST 2015
  **** IP Build 1412160 on Tue Nov 17 13:47:24 MST 2015
    ** Copyright 1986-2015 Xilinx, Inc. All Rights Reserved.

source synth_rca.tcl
# read_verilog [glob ../src/constants.v]
# read_verilog [glob ../src/nonlin_part.v]
# read_verilog [glob ../src/lin_part.v]
# read_verilog [glob ../src/decomposed_rca.v]
# synth_design -top decomposed_rca -part xc7z010clg400-1 -no_lc
Command: synth_design -top decomposed_rca -part xc7z010clg400-1 -no_lc
Starting synth_design
Attempting to get a license for feature 'Synthesis' and/or device 'xc7z010'
INFO: [Common 17-349] Got license for feature 'Synthesis' and/or device 'xc7z010'
INFO: Launching helper process for spawning children vivado processes
INFO: Helper process launched with PID 17293 
WARNING: [Synth 8-2644] root scope declaration is not allowed in verilog 95/2K mode [/home/danielrb/Dropbox/tesi/rca_adder/src/constants.v:1]
---------------------------------------------------------------------------------
Starting Synthesize : Time (s): cpu = 00:00:05 ; elapsed = 00:00:05 . Memory (MB): peak = 1102.617 ; gain = 172.371 ; free physical = 746 ; free virtual = 1867
---------------------------------------------------------------------------------
INFO: [Synth 8-638] synthesizing module 'decomposed_rca' [/home/danielrb/Dropbox/tesi/rca_adder/src/decomposed_rca.v:11]
	Parameter NBIT bound to: 28 - type: integer 
INFO: [Synth 8-638] synthesizing module 'nonlin_part' [/home/danielrb/Dropbox/tesi/rca_adder/src/nonlin_part.v:9]
	Parameter NBIT bound to: 28 - type: integer 
INFO: [Synth 8-256] done synthesizing module 'nonlin_part' (1#1) [/home/danielrb/Dropbox/tesi/rca_adder/src/nonlin_part.v:9]
INFO: [Synth 8-638] synthesizing module 'lin_part' [/home/danielrb/Dropbox/tesi/rca_adder/src/lin_part.v:7]
	Parameter NBIT bound to: 28 - type: integer 
INFO: [Synth 8-256] done synthesizing module 'lin_part' (2#1) [/home/danielrb/Dropbox/tesi/rca_adder/src/lin_part.v:7]
INFO: [Synth 8-256] done synthesizing module 'decomposed_rca' (3#1) [/home/danielrb/Dropbox/tesi/rca_adder/src/decomposed_rca.v:11]
---------------------------------------------------------------------------------
Finished Synthesize : Time (s): cpu = 00:00:06 ; elapsed = 00:00:06 . Memory (MB): peak = 1128.875 ; gain = 198.629 ; free physical = 720 ; free virtual = 1841
---------------------------------------------------------------------------------
---------------------------------------------------------------------------------
Finished Constraint Validation : Time (s): cpu = 00:00:06 ; elapsed = 00:00:06 . Memory (MB): peak = 1128.875 ; gain = 198.629 ; free physical = 720 ; free virtual = 1841
---------------------------------------------------------------------------------
---------------------------------------------------------------------------------
Start Loading Part and Timing Information
---------------------------------------------------------------------------------
Loading part: xc7z010clg400-1
---------------------------------------------------------------------------------
Finished Loading Part and Timing Information : Time (s): cpu = 00:00:06 ; elapsed = 00:00:06 . Memory (MB): peak = 1136.875 ; gain = 206.629 ; free physical = 720 ; free virtual = 1841
---------------------------------------------------------------------------------
INFO: [Device 21-403] Loading part xc7z010clg400-1
---------------------------------------------------------------------------------
Finished RTL Optimization Phase 2 : Time (s): cpu = 00:00:07 ; elapsed = 00:00:06 . Memory (MB): peak = 1144.879 ; gain = 214.633 ; free physical = 713 ; free virtual = 1834
---------------------------------------------------------------------------------

Report RTL Partitions: 
+-+--------------+------------+----------+
| |RTL Partition |Replication |Instances |
+-+--------------+------------+----------+
+-+--------------+------------+----------+
No constraint files found.
---------------------------------------------------------------------------------
Start RTL Component Statistics 
---------------------------------------------------------------------------------
Detailed RTL Component Info : 
+---XORs : 
	   3 Input      1 Bit         XORs := 51    
	   5 Input      1 Bit         XORs := 1     
	   2 Input      1 Bit         XORs := 1     
---------------------------------------------------------------------------------
Finished RTL Component Statistics 
---------------------------------------------------------------------------------
---------------------------------------------------------------------------------
Start RTL Hierarchical Component Statistics 
---------------------------------------------------------------------------------
Hierarchical RTL Component report 
Module lin_part 
Detailed RTL Component Info : 
+---XORs : 
	   3 Input      1 Bit         XORs := 51    
	   5 Input      1 Bit         XORs := 1     
	   2 Input      1 Bit         XORs := 1     
---------------------------------------------------------------------------------
Finished RTL Hierarchical Component Statistics
---------------------------------------------------------------------------------
---------------------------------------------------------------------------------
Start Part Resource Summary
---------------------------------------------------------------------------------
Part Resources:
DSPs: 80 (col length:40)
BRAMs: 120 (col length: RAMB18 40 RAMB36 20)
---------------------------------------------------------------------------------
Finished Part Resource Summary
---------------------------------------------------------------------------------
Start Parallel Synthesis Optimization  : Time (s): cpu = 00:00:09 ; elapsed = 00:00:09 . Memory (MB): peak = 1227.207 ; gain = 296.961 ; free physical = 638 ; free virtual = 1760
---------------------------------------------------------------------------------
Start Cross Boundary Optimization
---------------------------------------------------------------------------------
---------------------------------------------------------------------------------
Finished Cross Boundary Optimization : Time (s): cpu = 00:00:09 ; elapsed = 00:00:09 . Memory (MB): peak = 1227.207 ; gain = 296.961 ; free physical = 640 ; free virtual = 1761
---------------------------------------------------------------------------------
Finished Parallel Reinference  : Time (s): cpu = 00:00:09 ; elapsed = 00:00:09 . Memory (MB): peak = 1227.207 ; gain = 296.961 ; free physical = 640 ; free virtual = 1761

Report RTL Partitions: 
+-+--------------+------------+----------+
| |RTL Partition |Replication |Instances |
+-+--------------+------------+----------+
+-+--------------+------------+----------+
No constraint files found.
---------------------------------------------------------------------------------
Start Area Optimization
---------------------------------------------------------------------------------
---------------------------------------------------------------------------------
Finished Area Optimization : Time (s): cpu = 00:00:10 ; elapsed = 00:00:09 . Memory (MB): peak = 1243.215 ; gain = 312.969 ; free physical = 624 ; free virtual = 1745
---------------------------------------------------------------------------------
Finished Parallel Area Optimization  : Time (s): cpu = 00:00:10 ; elapsed = 00:00:09 . Memory (MB): peak = 1243.215 ; gain = 312.969 ; free physical = 624 ; free virtual = 1745

Report RTL Partitions: 
+-+--------------+------------+----------+
| |RTL Partition |Replication |Instances |
+-+--------------+------------+----------+
+-+--------------+------------+----------+
---------------------------------------------------------------------------------
Start Timing Optimization
---------------------------------------------------------------------------------
No constraint files found.
---------------------------------------------------------------------------------
Finished Timing Optimization : Time (s): cpu = 00:00:10 ; elapsed = 00:00:09 . Memory (MB): peak = 1243.215 ; gain = 312.969 ; free physical = 624 ; free virtual = 1745
---------------------------------------------------------------------------------

Report RTL Partitions: 
+-+--------------+------------+----------+
| |RTL Partition |Replication |Instances |
+-+--------------+------------+----------+
+-+--------------+------------+----------+
---------------------------------------------------------------------------------
Start Technology Mapping
---------------------------------------------------------------------------------
---------------------------------------------------------------------------------
Finished Technology Mapping : Time (s): cpu = 00:00:10 ; elapsed = 00:00:09 . Memory (MB): peak = 1243.215 ; gain = 312.969 ; free physical = 624 ; free virtual = 1745
---------------------------------------------------------------------------------
Finished Parallel Technology Mapping Optimization  : Time (s): cpu = 00:00:10 ; elapsed = 00:00:09 . Memory (MB): peak = 1243.215 ; gain = 312.969 ; free physical = 624 ; free virtual = 1745

Report RTL Partitions: 
+-+--------------+------------+----------+
| |RTL Partition |Replication |Instances |
+-+--------------+------------+----------+
+-+--------------+------------+----------+
Finished Parallel Synthesis Optimization  : Time (s): cpu = 00:00:10 ; elapsed = 00:00:09 . Memory (MB): peak = 1243.215 ; gain = 312.969 ; free physical = 624 ; free virtual = 1745
---------------------------------------------------------------------------------
Start IO Insertion
---------------------------------------------------------------------------------
---------------------------------------------------------------------------------
Start Flattening Before IO Insertion
---------------------------------------------------------------------------------
---------------------------------------------------------------------------------
Finished Flattening Before IO Insertion
---------------------------------------------------------------------------------
---------------------------------------------------------------------------------
Start Final Netlist Cleanup
---------------------------------------------------------------------------------
---------------------------------------------------------------------------------
Finished Final Netlist Cleanup
---------------------------------------------------------------------------------
---------------------------------------------------------------------------------
Finished IO Insertion : Time (s): cpu = 00:00:10 ; elapsed = 00:00:10 . Memory (MB): peak = 1243.215 ; gain = 312.969 ; free physical = 624 ; free virtual = 1745
---------------------------------------------------------------------------------

Report Check Netlist: 
+------+------------------+-------+---------+-------+------------------+
|      |Item              |Errors |Warnings |Status |Description       |
+------+------------------+-------+---------+-------+------------------+
|1     |multi_driven_nets |      0|        0|Passed |Multi driven nets |
+------+------------------+-------+---------+-------+------------------+
---------------------------------------------------------------------------------
Start Renaming Generated Instances
---------------------------------------------------------------------------------
---------------------------------------------------------------------------------
Finished Renaming Generated Instances : Time (s): cpu = 00:00:10 ; elapsed = 00:00:10 . Memory (MB): peak = 1243.215 ; gain = 312.969 ; free physical = 624 ; free virtual = 1745
---------------------------------------------------------------------------------

Report RTL Partitions: 
+-+--------------+------------+----------+
| |RTL Partition |Replication |Instances |
+-+--------------+------------+----------+
+-+--------------+------------+----------+
---------------------------------------------------------------------------------
Start Rebuilding User Hierarchy
---------------------------------------------------------------------------------
---------------------------------------------------------------------------------
Finished Rebuilding User Hierarchy : Time (s): cpu = 00:00:10 ; elapsed = 00:00:10 . Memory (MB): peak = 1243.215 ; gain = 312.969 ; free physical = 624 ; free virtual = 1745
---------------------------------------------------------------------------------
---------------------------------------------------------------------------------
Start Renaming Generated Ports
---------------------------------------------------------------------------------
---------------------------------------------------------------------------------
Finished Renaming Generated Ports : Time (s): cpu = 00:00:10 ; elapsed = 00:00:10 . Memory (MB): peak = 1243.215 ; gain = 312.969 ; free physical = 624 ; free virtual = 1745
---------------------------------------------------------------------------------
---------------------------------------------------------------------------------
Start Handling Custom Attributes
---------------------------------------------------------------------------------
---------------------------------------------------------------------------------
Finished Handling Custom Attributes : Time (s): cpu = 00:00:10 ; elapsed = 00:00:10 . Memory (MB): peak = 1243.215 ; gain = 312.969 ; free physical = 624 ; free virtual = 1745
---------------------------------------------------------------------------------
---------------------------------------------------------------------------------
Start Renaming Generated Nets
---------------------------------------------------------------------------------
---------------------------------------------------------------------------------
Finished Renaming Generated Nets : Time (s): cpu = 00:00:10 ; elapsed = 00:00:10 . Memory (MB): peak = 1243.215 ; gain = 312.969 ; free physical = 624 ; free virtual = 1745
---------------------------------------------------------------------------------
---------------------------------------------------------------------------------
Start Writing Synthesis Report
---------------------------------------------------------------------------------

Report BlackBoxes: 
+-+--------------+----------+
| |BlackBox name |Instances |
+-+--------------+----------+
+-+--------------+----------+

Report Cell Usage: 
+------+-----+------+
|      |Cell |Count |
+------+-----+------+
|1     |LUT2 |     1|
|2     |LUT3 |    26|
|3     |LUT4 |     2|
|4     |LUT5 |    25|
|5     |LUT6 |     1|
|6     |IBUF |    56|
|7     |OBUF |    28|
+------+-----+------+

Report Instance Areas: 
+------+---------+-------+------+
|      |Instance |Module |Cells |
+------+---------+-------+------+
|1     |top      |       |   139|
+------+---------+-------+------+
---------------------------------------------------------------------------------
Finished Writing Synthesis Report : Time (s): cpu = 00:00:10 ; elapsed = 00:00:10 . Memory (MB): peak = 1243.215 ; gain = 312.969 ; free physical = 624 ; free virtual = 1745
---------------------------------------------------------------------------------
Synthesis finished with 0 errors, 0 critical warnings and 1 warnings.
Synthesis Optimization Runtime : Time (s): cpu = 00:00:08 ; elapsed = 00:00:08 . Memory (MB): peak = 1243.215 ; gain = 192.723 ; free physical = 624 ; free virtual = 1745
Synthesis Optimization Complete : Time (s): cpu = 00:00:10 ; elapsed = 00:00:10 . Memory (MB): peak = 1243.215 ; gain = 312.969 ; free physical = 624 ; free virtual = 1745
INFO: [Project 1-571] Translating synthesized netlist
INFO: [Netlist 29-17] Analyzing 56 Unisim elements for replacement
INFO: [Netlist 29-28] Unisim Transformation completed in 0 CPU seconds
INFO: [Project 1-570] Preparing netlist for logic optimization
INFO: [Opt 31-138] Pushed 0 inverter(s) to 0 load pin(s).
INFO: [Project 1-111] Unisim Transformation Summary:
No Unisim elements were transformed.

INFO: [Common 17-83] Releasing license: Synthesis
15 Infos, 1 Warnings, 0 Critical Warnings and 0 Errors encountered.
synth_design completed successfully
synth_design: Time (s): cpu = 00:00:09 ; elapsed = 00:00:09 . Memory (MB): peak = 1313.215 ; gain = 311.633 ; free physical = 551 ; free virtual = 1672
# opt_design
Command: opt_design
Attempting to get a license for feature 'Implementation' and/or device 'xc7z010'
INFO: [Common 17-349] Got license for feature 'Implementation' and/or device 'xc7z010'
Running DRC as a precondition to command opt_design

Starting DRC Task
INFO: [DRC 23-27] Running DRC with 4 threads
INFO: [Project 1-461] DRC finished with 0 Errors
INFO: [Project 1-462] Please refer to the DRC report (report_drc) for more information.

Time (s): cpu = 00:00:00.07 ; elapsed = 00:00:00.07 . Memory (MB): peak = 1345.230 ; gain = 32.016 ; free physical = 551 ; free virtual = 1671
INFO: [Timing 38-35] Done setting XDC timing constraints.

Starting Logic Optimization Task
Implement Debug Cores | Checksum: 989a115d

Phase 1 Retarget
INFO: [Opt 31-138] Pushed 0 inverter(s) to 0 load pin(s).
INFO: [Opt 31-49] Retargeted 0 cell(s).
Phase 1 Retarget | Checksum: 989a115d

Time (s): cpu = 00:00:00 ; elapsed = 00:00:00.01 . Memory (MB): peak = 1722.723 ; gain = 0.000 ; free physical = 249 ; free virtual = 1370

Phase 2 Constant Propagation
INFO: [Opt 31-138] Pushed 0 inverter(s) to 0 load pin(s).
INFO: [Opt 31-10] Eliminated 0 cells.
Phase 2 Constant Propagation | Checksum: 989a115d

Time (s): cpu = 00:00:00.01 ; elapsed = 00:00:00.01 . Memory (MB): peak = 1722.723 ; gain = 0.000 ; free physical = 249 ; free virtual = 1370

Phase 3 Sweep
INFO: [Opt 31-12] Eliminated 0 unconnected nets.
INFO: [Opt 31-11] Eliminated 0 unconnected cells.
Phase 3 Sweep | Checksum: 989a115d

Time (s): cpu = 00:00:00.01 ; elapsed = 00:00:00.02 . Memory (MB): peak = 1722.723 ; gain = 0.000 ; free physical = 249 ; free virtual = 1370

Starting Connectivity Check Task

Time (s): cpu = 00:00:00 ; elapsed = 00:00:00 . Memory (MB): peak = 1722.723 ; gain = 0.000 ; free physical = 249 ; free virtual = 1370
Ending Logic Optimization Task | Checksum: 989a115d

Time (s): cpu = 00:00:00.01 ; elapsed = 00:00:00.02 . Memory (MB): peak = 1722.723 ; gain = 0.000 ; free physical = 249 ; free virtual = 1370

Starting Power Optimization Task
INFO: [Pwropt 34-132] Skipping clock gating for clocks with a period < 2.00 ns.
Ending Power Optimization Task | Checksum: 989a115d

Time (s): cpu = 00:00:00.01 ; elapsed = 00:00:00.01 . Memory (MB): peak = 1722.723 ; gain = 0.000 ; free physical = 249 ; free virtual = 1370
INFO: [Common 17-83] Releasing license: Implementation
13 Infos, 0 Warnings, 0 Critical Warnings and 0 Errors encountered.
opt_design completed successfully
opt_design: Time (s): cpu = 00:00:09 ; elapsed = 00:00:09 . Memory (MB): peak = 1722.723 ; gain = 409.508 ; free physical = 249 ; free virtual = 1370
# place_design
Command: place_design
Attempting to get a license for feature 'Implementation' and/or device 'xc7z010'
INFO: [Common 17-349] Got license for feature 'Implementation' and/or device 'xc7z010'
INFO: [DRC 23-27] Running DRC with 4 threads
INFO: [Vivado_Tcl 4-198] DRC finished with 0 Errors
INFO: [Vivado_Tcl 4-199] Please refer to the DRC report (report_drc) for more information.
Running DRC as a precondition to command place_design
INFO: [DRC 23-27] Running DRC with 4 threads
INFO: [Vivado_Tcl 4-198] DRC finished with 0 Errors
INFO: [Vivado_Tcl 4-199] Please refer to the DRC report (report_drc) for more information.

Starting Placer Task
INFO: [Place 30-611] Multithreading enabled for place_design using a maximum of 4 CPUs

Phase 1 Placer Initialization
Netlist sorting complete. Time (s): cpu = 00:00:00 ; elapsed = 00:00:00 . Memory (MB): peak = 1754.738 ; gain = 0.000 ; free physical = 248 ; free virtual = 1369
Netlist sorting complete. Time (s): cpu = 00:00:00 ; elapsed = 00:00:00 . Memory (MB): peak = 1754.738 ; gain = 0.000 ; free physical = 248 ; free virtual = 1369

Phase 1.1 IO Placement/ Clock Placement/ Build Placer Device

Phase 1.1.1 Pre-Place Cells
Phase 1.1.1 Pre-Place Cells | Checksum: 00000000

Time (s): cpu = 00:00:00.01 ; elapsed = 00:00:00.01 . Memory (MB): peak = 1754.738 ; gain = 0.000 ; free physical = 248 ; free virtual = 1369
INFO: [Timing 38-35] Done setting XDC timing constraints.

Phase 1.1.2 IO and Clk Clean Up
Phase 1.1.2 IO and Clk Clean Up | Checksum: 00000000

Time (s): cpu = 00:00:00.55 ; elapsed = 00:00:00.40 . Memory (MB): peak = 1777.746 ; gain = 23.008 ; free physical = 247 ; free virtual = 1369

Phase 1.1.3 Implementation Feasibility check On IDelay
Phase 1.1.3 Implementation Feasibility check On IDelay | Checksum: 00000000

Time (s): cpu = 00:00:00.55 ; elapsed = 00:00:00.41 . Memory (MB): peak = 1777.746 ; gain = 23.008 ; free physical = 247 ; free virtual = 1369

Phase 1.1.4 Commit IO Placement
Phase 1.1.4 Commit IO Placement | Checksum: 4d771a67

Time (s): cpu = 00:00:00.56 ; elapsed = 00:00:00.42 . Memory (MB): peak = 1777.746 ; gain = 23.008 ; free physical = 247 ; free virtual = 1369
Phase 1.1 IO Placement/ Clock Placement/ Build Placer Device | Checksum: a32d28de

Time (s): cpu = 00:00:00.56 ; elapsed = 00:00:00.42 . Memory (MB): peak = 1777.746 ; gain = 23.008 ; free physical = 247 ; free virtual = 1369

Phase 1.2 Build Placer Netlist Model

Phase 1.2.1 Place Init Design
Phase 1.2.1 Place Init Design | Checksum: 12249645d

Time (s): cpu = 00:00:00.58 ; elapsed = 00:00:00.43 . Memory (MB): peak = 1777.746 ; gain = 23.008 ; free physical = 247 ; free virtual = 1369
Phase 1.2 Build Placer Netlist Model | Checksum: 12249645d

Time (s): cpu = 00:00:00.58 ; elapsed = 00:00:00.43 . Memory (MB): peak = 1777.746 ; gain = 23.008 ; free physical = 247 ; free virtual = 1369

Phase 1.3 Constrain Clocks/Macros

Phase 1.3.1 Constrain Global/Regional Clocks
Phase 1.3.1 Constrain Global/Regional Clocks | Checksum: 12249645d

Time (s): cpu = 00:00:00.58 ; elapsed = 00:00:00.43 . Memory (MB): peak = 1777.746 ; gain = 23.008 ; free physical = 247 ; free virtual = 1369
Phase 1.3 Constrain Clocks/Macros | Checksum: 12249645d

Time (s): cpu = 00:00:00.58 ; elapsed = 00:00:00.43 . Memory (MB): peak = 1777.746 ; gain = 23.008 ; free physical = 247 ; free virtual = 1369
Phase 1 Placer Initialization | Checksum: 12249645d

Time (s): cpu = 00:00:00.58 ; elapsed = 00:00:00.43 . Memory (MB): peak = 1777.746 ; gain = 23.008 ; free physical = 247 ; free virtual = 1369

Phase 2 Global Placement
Phase 2 Global Placement | Checksum: f82a16d4

Time (s): cpu = 00:00:00.81 ; elapsed = 00:00:00.52 . Memory (MB): peak = 1809.762 ; gain = 55.023 ; free physical = 247 ; free virtual = 1368

Phase 3 Detail Placement

Phase 3.1 Commit Multi Column Macros
Phase 3.1 Commit Multi Column Macros | Checksum: f82a16d4

Time (s): cpu = 00:00:00.82 ; elapsed = 00:00:00.52 . Memory (MB): peak = 1809.762 ; gain = 55.023 ; free physical = 247 ; free virtual = 1368

Phase 3.2 Commit Most Macros & LUTRAMs
Phase 3.2 Commit Most Macros & LUTRAMs | Checksum: 161b2bdf7

Time (s): cpu = 00:00:00.83 ; elapsed = 00:00:00.53 . Memory (MB): peak = 1809.762 ; gain = 55.023 ; free physical = 247 ; free virtual = 1368

Phase 3.3 Area Swap Optimization
Phase 3.3 Area Swap Optimization | Checksum: fb0e22e2

Time (s): cpu = 00:00:00.84 ; elapsed = 00:00:00.53 . Memory (MB): peak = 1809.762 ; gain = 55.023 ; free physical = 247 ; free virtual = 1368

Phase 3.4 Small Shape Detail Placement

Phase 3.4.1 Commit Small Macros and Core Logic

Phase 3.4.1.1 Commit Slice Clusters
Phase 3.4.1.1 Commit Slice Clusters | Checksum: 2239d8585

Time (s): cpu = 00:00:00.90 ; elapsed = 00:00:00.59 . Memory (MB): peak = 1809.762 ; gain = 55.023 ; free physical = 247 ; free virtual = 1368
Phase 3.4.1 Commit Small Macros and Core Logic | Checksum: 2239d8585

Time (s): cpu = 00:00:00.90 ; elapsed = 00:00:00.59 . Memory (MB): peak = 1809.762 ; gain = 55.023 ; free physical = 247 ; free virtual = 1368

Phase 3.4.2 Clock Restriction Legalization for Leaf Columns
Phase 3.4.2 Clock Restriction Legalization for Leaf Columns | Checksum: 2239d8585

Time (s): cpu = 00:00:00.91 ; elapsed = 00:00:00.59 . Memory (MB): peak = 1809.762 ; gain = 55.023 ; free physical = 247 ; free virtual = 1368

Phase 3.4.3 Clock Restriction Legalization for Non-Clock Pins
Phase 3.4.3 Clock Restriction Legalization for Non-Clock Pins | Checksum: 2239d8585

Time (s): cpu = 00:00:00.92 ; elapsed = 00:00:00.59 . Memory (MB): peak = 1809.762 ; gain = 55.023 ; free physical = 247 ; free virtual = 1368
Phase 3.4 Small Shape Detail Placement | Checksum: 2239d8585

Time (s): cpu = 00:00:00.92 ; elapsed = 00:00:00.59 . Memory (MB): peak = 1809.762 ; gain = 55.023 ; free physical = 247 ; free virtual = 1368

Phase 3.5 Re-assign LUT pins
Phase 3.5 Re-assign LUT pins | Checksum: 2239d8585

Time (s): cpu = 00:00:00.92 ; elapsed = 00:00:00.60 . Memory (MB): peak = 1809.762 ; gain = 55.023 ; free physical = 247 ; free virtual = 1368
Phase 3 Detail Placement | Checksum: 2239d8585

Time (s): cpu = 00:00:00.92 ; elapsed = 00:00:00.60 . Memory (MB): peak = 1809.762 ; gain = 55.023 ; free physical = 247 ; free virtual = 1368

Phase 4 Post Placement Optimization and Clean-Up

Phase 4.1 Post Commit Optimization
Phase 4.1 Post Commit Optimization | Checksum: 2239d8585

Time (s): cpu = 00:00:00.93 ; elapsed = 00:00:00.60 . Memory (MB): peak = 1809.762 ; gain = 55.023 ; free physical = 247 ; free virtual = 1368

Phase 4.2 Sweep Clock Roots: Post-Placement
Phase 4.2 Sweep Clock Roots: Post-Placement | Checksum: 2239d8585

Time (s): cpu = 00:00:00.93 ; elapsed = 00:00:00.60 . Memory (MB): peak = 1809.762 ; gain = 55.023 ; free physical = 247 ; free virtual = 1368

Phase 4.3 Post Placement Cleanup
Phase 4.3 Post Placement Cleanup | Checksum: 2239d8585

Time (s): cpu = 00:00:00.93 ; elapsed = 00:00:00.60 . Memory (MB): peak = 1809.762 ; gain = 55.023 ; free physical = 247 ; free virtual = 1368

Phase 4.4 Placer Reporting
Phase 4.4 Placer Reporting | Checksum: 2239d8585

Time (s): cpu = 00:00:00.93 ; elapsed = 00:00:00.60 . Memory (MB): peak = 1809.762 ; gain = 55.023 ; free physical = 247 ; free virtual = 1368

Phase 4.5 Final Placement Cleanup
Phase 4.5 Final Placement Cleanup | Checksum: 2239d8585

Time (s): cpu = 00:00:00.93 ; elapsed = 00:00:00.61 . Memory (MB): peak = 1809.762 ; gain = 55.023 ; free physical = 247 ; free virtual = 1368
Phase 4 Post Placement Optimization and Clean-Up | Checksum: 2239d8585

Time (s): cpu = 00:00:00.93 ; elapsed = 00:00:00.61 . Memory (MB): peak = 1809.762 ; gain = 55.023 ; free physical = 247 ; free virtual = 1368
Ending Placer Task | Checksum: 12d9d410d

Time (s): cpu = 00:00:00.94 ; elapsed = 00:00:00.61 . Memory (MB): peak = 1809.762 ; gain = 55.023 ; free physical = 247 ; free virtual = 1368
INFO: [Common 17-83] Releasing license: Implementation
10 Infos, 0 Warnings, 0 Critical Warnings and 0 Errors encountered.
place_design completed successfully
# route_design
Command: route_design
Attempting to get a license for feature 'Implementation' and/or device 'xc7z010'
INFO: [Common 17-349] Got license for feature 'Implementation' and/or device 'xc7z010'
Running DRC as a precondition to command route_design
INFO: [DRC 23-27] Running DRC with 4 threads
INFO: [Vivado_Tcl 4-198] DRC finished with 0 Errors
INFO: [Vivado_Tcl 4-199] Please refer to the DRC report (report_drc) for more information.


Starting Routing Task
INFO: [Route 35-254] Multithreading enabled for route_design using a maximum of 4 CPUs
Checksum: PlaceDB: d7e73296 ConstDB: 0 ShapeSum: 55b60e77 RouteDB: 0

Phase 1 Build RT Design
Phase 1 Build RT Design | Checksum: 915ba2c4

Time (s): cpu = 00:00:11 ; elapsed = 00:00:09 . Memory (MB): peak = 1809.762 ; gain = 0.000 ; free physical = 176 ; free virtual = 1298

Phase 2 Router Initialization
INFO: [Route 35-64] No timing constraints were detected. The router will operate in resource-optimization mode.

Phase 2.1 Pre Route Cleanup
Phase 2.1 Pre Route Cleanup | Checksum: 915ba2c4

Time (s): cpu = 00:00:11 ; elapsed = 00:00:09 . Memory (MB): peak = 1816.754 ; gain = 6.992 ; free physical = 162 ; free virtual = 1284
Phase 2 Router Initialization | Checksum: 915ba2c4

Time (s): cpu = 00:00:11 ; elapsed = 00:00:09 . Memory (MB): peak = 1819.754 ; gain = 9.992 ; free physical = 159 ; free virtual = 1280

Phase 3 Initial Routing
Phase 3 Initial Routing | Checksum: 12b7423a3

Time (s): cpu = 00:00:11 ; elapsed = 00:00:09 . Memory (MB): peak = 1819.754 ; gain = 9.992 ; free physical = 159 ; free virtual = 1280

Phase 4 Rip-up And Reroute

Phase 4.1 Global Iteration 0
 Number of Nodes with overlaps = 1
 Number of Nodes with overlaps = 0
Phase 4.1 Global Iteration 0 | Checksum: 15619bb34

Time (s): cpu = 00:00:11 ; elapsed = 00:00:09 . Memory (MB): peak = 1819.754 ; gain = 9.992 ; free physical = 159 ; free virtual = 1280
Phase 4 Rip-up And Reroute | Checksum: 15619bb34

Time (s): cpu = 00:00:11 ; elapsed = 00:00:09 . Memory (MB): peak = 1819.754 ; gain = 9.992 ; free physical = 159 ; free virtual = 1280

Phase 5 Delay and Skew Optimization
Phase 5 Delay and Skew Optimization | Checksum: 15619bb34

Time (s): cpu = 00:00:11 ; elapsed = 00:00:09 . Memory (MB): peak = 1819.754 ; gain = 9.992 ; free physical = 159 ; free virtual = 1280

Phase 6 Post Hold Fix
Phase 6 Post Hold Fix | Checksum: 15619bb34

Time (s): cpu = 00:00:11 ; elapsed = 00:00:09 . Memory (MB): peak = 1819.754 ; gain = 9.992 ; free physical = 159 ; free virtual = 1280

Phase 7 Route finalize

Router Utilization Summary
  Global Vertical Routing Utilization    = 0.304899 %
  Global Horizontal Routing Utilization  = 0.0436581 %
  Routable Net Status*
  *Does not include unroutable nets such as driverless and loadless.
  Run report_route_status for detailed report.
  Number of Failed Nets               = 0
  Number of Unrouted Nets             = 0
  Number of Partially Routed Nets     = 0
  Number of Node Overlaps             = 0

Congestion Report
North Dir 1x1 Area, Max Cong = 25.2252%, No Congested Regions.
South Dir 1x1 Area, Max Cong = 25.2252%, No Congested Regions.
East Dir 1x1 Area, Max Cong = 5.88235%, No Congested Regions.
West Dir 1x1 Area, Max Cong = 7.35294%, No Congested Regions.
Phase 7 Route finalize | Checksum: 15619bb34

Time (s): cpu = 00:00:11 ; elapsed = 00:00:09 . Memory (MB): peak = 1819.754 ; gain = 9.992 ; free physical = 159 ; free virtual = 1280

Phase 8 Verifying routed nets

 Verification completed successfully
Phase 8 Verifying routed nets | Checksum: 15619bb34

Time (s): cpu = 00:00:11 ; elapsed = 00:00:09 . Memory (MB): peak = 1821.754 ; gain = 11.992 ; free physical = 157 ; free virtual = 1278

Phase 9 Depositing Routes
Phase 9 Depositing Routes | Checksum: 11fd6488b

Time (s): cpu = 00:00:11 ; elapsed = 00:00:09 . Memory (MB): peak = 1821.754 ; gain = 11.992 ; free physical = 157 ; free virtual = 1278
INFO: [Route 35-16] Router Completed Successfully

Time (s): cpu = 00:00:11 ; elapsed = 00:00:09 . Memory (MB): peak = 1821.754 ; gain = 11.992 ; free physical = 157 ; free virtual = 1278

Routing Is Done.
INFO: [Common 17-83] Releasing license: Implementation
8 Infos, 0 Warnings, 0 Critical Warnings and 0 Errors encountered.
route_design completed successfully
route_design: Time (s): cpu = 00:00:12 ; elapsed = 00:00:10 . Memory (MB): peak = 1821.852 ; gain = 12.090 ; free physical = 157 ; free virtual = 1278
# report_utilization -file ./reports/area/28bit_decomposed_rca_util.rpt
report_utilization: Time (s): cpu = 00:00:00.01 ; elapsed = 00:00:00.01 . Memory (MB): peak = 1821.852 ; gain = 0.000 ; free physical = 156 ; free virtual = 1278
# report_power -file ./reports/power/28bit_decomposed_rca_power.rpt
WARNING: [Power 33-232] No user defined clocks were found in the design!
Resolution: Please specify clocks using create_clock/create_generated_clock for sequential elements. For pure combinatorial circuits, please specify a virtual clock, otherwise the vectorless estimation might be inaccurate
Running Vector-less Activity Propagation...

Finished Running Vector-less Activity Propagation
# report_timing -file ./reports/timing/28bit_decomposed_rca_timing.rpt
INFO: [Timing 38-91] UpdateTimingParams: Speed grade: -1, Delay Type: max.
INFO: [Timing 38-191] Multithreading enabled for timing update using a maximum of 4 CPUs
INFO: [Timing 38-78] ReportTimingParams: -max_paths 1 -nworst 1 -delay_type max -sort_by slack.
# exit
INFO: [Common 17-206] Exiting Vivado at Wed Apr 27 15:28:31 2016...
