
****** Vivado v2015.4 (64-bit)
  **** SW Build 1412921 on Wed Nov 18 09:44:32 MST 2015
  **** IP Build 1412160 on Tue Nov 17 13:47:24 MST 2015
    ** Copyright 1986-2015 Xilinx, Inc. All Rights Reserved.

source synth_rca.tcl
# read_verilog [glob ./constants.v]
# read_verilog [glob ./adder.v]
# synth_design -top adder -part xc7z010clg400-1
Command: synth_design -top adder -part xc7z010clg400-1
Starting synth_design
Attempting to get a license for feature 'Synthesis' and/or device 'xc7z010'
INFO: [Common 17-349] Got license for feature 'Synthesis' and/or device 'xc7z010'
INFO: Launching helper process for spawning children vivado processes
INFO: Helper process launched with PID 10978 
WARNING: [Synth 8-2644] root scope declaration is not allowed in verilog 95/2K mode [/home/danielrb/Dropbox/tesi/rca_adder/undecomposed/constants.v:1]
---------------------------------------------------------------------------------
Starting Synthesize : Time (s): cpu = 00:00:05 ; elapsed = 00:00:05 . Memory (MB): peak = 1102.613 ; gain = 172.371 ; free physical = 1212 ; free virtual = 2389
---------------------------------------------------------------------------------
INFO: [Synth 8-638] synthesizing module 'adder' [/home/danielrb/Dropbox/tesi/rca_adder/undecomposed/adder.v:1]
	Parameter NBIT bound to: 22 - type: integer 
INFO: [Synth 8-256] done synthesizing module 'adder' (1#1) [/home/danielrb/Dropbox/tesi/rca_adder/undecomposed/adder.v:1]
---------------------------------------------------------------------------------
Finished Synthesize : Time (s): cpu = 00:00:06 ; elapsed = 00:00:06 . Memory (MB): peak = 1126.871 ; gain = 196.629 ; free physical = 1186 ; free virtual = 2364
---------------------------------------------------------------------------------
---------------------------------------------------------------------------------
Finished Constraint Validation : Time (s): cpu = 00:00:06 ; elapsed = 00:00:06 . Memory (MB): peak = 1126.871 ; gain = 196.629 ; free physical = 1186 ; free virtual = 2364
---------------------------------------------------------------------------------
---------------------------------------------------------------------------------
Start Loading Part and Timing Information
---------------------------------------------------------------------------------
Loading part: xc7z010clg400-1
---------------------------------------------------------------------------------
Finished Loading Part and Timing Information : Time (s): cpu = 00:00:06 ; elapsed = 00:00:06 . Memory (MB): peak = 1134.871 ; gain = 204.629 ; free physical = 1186 ; free virtual = 2364
---------------------------------------------------------------------------------
---------------------------------------------------------------------------------
Finished RTL Optimization Phase 2 : Time (s): cpu = 00:00:06 ; elapsed = 00:00:06 . Memory (MB): peak = 1142.875 ; gain = 212.633 ; free physical = 1176 ; free virtual = 2354
---------------------------------------------------------------------------------
INFO: [Device 21-403] Loading part xc7z010clg400-1

Report RTL Partitions: 
+-+--------------+------------+----------+
| |RTL Partition |Replication |Instances |
+-+--------------+------------+----------+
+-+--------------+------------+----------+
No constraint files found.
---------------------------------------------------------------------------------
Start RTL Component Statistics 
---------------------------------------------------------------------------------
Detailed RTL Component Info : 
+---Adders : 
	   2 Input     22 Bit       Adders := 1     
---------------------------------------------------------------------------------
Finished RTL Component Statistics 
---------------------------------------------------------------------------------
---------------------------------------------------------------------------------
Start RTL Hierarchical Component Statistics 
---------------------------------------------------------------------------------
Hierarchical RTL Component report 
Module adder 
Detailed RTL Component Info : 
+---Adders : 
	   2 Input     22 Bit       Adders := 1     
---------------------------------------------------------------------------------
Finished RTL Hierarchical Component Statistics
---------------------------------------------------------------------------------
---------------------------------------------------------------------------------
Start Part Resource Summary
---------------------------------------------------------------------------------
Part Resources:
DSPs: 80 (col length:40)
BRAMs: 120 (col length: RAMB18 40 RAMB36 20)
---------------------------------------------------------------------------------
Finished Part Resource Summary
---------------------------------------------------------------------------------
Start Parallel Synthesis Optimization  : Time (s): cpu = 00:00:09 ; elapsed = 00:00:09 . Memory (MB): peak = 1218.203 ; gain = 287.961 ; free physical = 1109 ; free virtual = 2286
---------------------------------------------------------------------------------
Start Cross Boundary Optimization
---------------------------------------------------------------------------------
---------------------------------------------------------------------------------
Finished Cross Boundary Optimization : Time (s): cpu = 00:00:09 ; elapsed = 00:00:09 . Memory (MB): peak = 1226.203 ; gain = 295.961 ; free physical = 1102 ; free virtual = 2280
---------------------------------------------------------------------------------
Finished Parallel Reinference  : Time (s): cpu = 00:00:09 ; elapsed = 00:00:09 . Memory (MB): peak = 1226.203 ; gain = 295.961 ; free physical = 1102 ; free virtual = 2280

Report RTL Partitions: 
+-+--------------+------------+----------+
| |RTL Partition |Replication |Instances |
+-+--------------+------------+----------+
+-+--------------+------------+----------+
No constraint files found.
---------------------------------------------------------------------------------
Start Area Optimization
---------------------------------------------------------------------------------
---------------------------------------------------------------------------------
Finished Area Optimization : Time (s): cpu = 00:00:09 ; elapsed = 00:00:09 . Memory (MB): peak = 1226.207 ; gain = 295.965 ; free physical = 1100 ; free virtual = 2278
---------------------------------------------------------------------------------
Finished Parallel Area Optimization  : Time (s): cpu = 00:00:09 ; elapsed = 00:00:09 . Memory (MB): peak = 1226.207 ; gain = 295.965 ; free physical = 1100 ; free virtual = 2278

Report RTL Partitions: 
+-+--------------+------------+----------+
| |RTL Partition |Replication |Instances |
+-+--------------+------------+----------+
+-+--------------+------------+----------+
---------------------------------------------------------------------------------
Start Timing Optimization
---------------------------------------------------------------------------------
No constraint files found.
---------------------------------------------------------------------------------
Finished Timing Optimization : Time (s): cpu = 00:00:09 ; elapsed = 00:00:09 . Memory (MB): peak = 1226.207 ; gain = 295.965 ; free physical = 1100 ; free virtual = 2278
---------------------------------------------------------------------------------

Report RTL Partitions: 
+-+--------------+------------+----------+
| |RTL Partition |Replication |Instances |
+-+--------------+------------+----------+
+-+--------------+------------+----------+
---------------------------------------------------------------------------------
Start Technology Mapping
---------------------------------------------------------------------------------
---------------------------------------------------------------------------------
Finished Technology Mapping : Time (s): cpu = 00:00:09 ; elapsed = 00:00:09 . Memory (MB): peak = 1234.211 ; gain = 303.969 ; free physical = 1092 ; free virtual = 2270
---------------------------------------------------------------------------------
Finished Parallel Technology Mapping Optimization  : Time (s): cpu = 00:00:09 ; elapsed = 00:00:09 . Memory (MB): peak = 1234.211 ; gain = 303.969 ; free physical = 1092 ; free virtual = 2270

Report RTL Partitions: 
+-+--------------+------------+----------+
| |RTL Partition |Replication |Instances |
+-+--------------+------------+----------+
+-+--------------+------------+----------+
Finished Parallel Synthesis Optimization  : Time (s): cpu = 00:00:09 ; elapsed = 00:00:09 . Memory (MB): peak = 1234.211 ; gain = 303.969 ; free physical = 1092 ; free virtual = 2270
---------------------------------------------------------------------------------
Start IO Insertion
---------------------------------------------------------------------------------
---------------------------------------------------------------------------------
Start Flattening Before IO Insertion
---------------------------------------------------------------------------------
---------------------------------------------------------------------------------
Finished Flattening Before IO Insertion
---------------------------------------------------------------------------------
---------------------------------------------------------------------------------
Start Final Netlist Cleanup
---------------------------------------------------------------------------------
---------------------------------------------------------------------------------
Finished Final Netlist Cleanup
---------------------------------------------------------------------------------
---------------------------------------------------------------------------------
Finished IO Insertion : Time (s): cpu = 00:00:09 ; elapsed = 00:00:09 . Memory (MB): peak = 1234.211 ; gain = 303.969 ; free physical = 1091 ; free virtual = 2269
---------------------------------------------------------------------------------

Report Check Netlist: 
+------+------------------+-------+---------+-------+------------------+
|      |Item              |Errors |Warnings |Status |Description       |
+------+------------------+-------+---------+-------+------------------+
|1     |multi_driven_nets |      0|        0|Passed |Multi driven nets |
+------+------------------+-------+---------+-------+------------------+
---------------------------------------------------------------------------------
Start Renaming Generated Instances
---------------------------------------------------------------------------------
---------------------------------------------------------------------------------
Finished Renaming Generated Instances : Time (s): cpu = 00:00:09 ; elapsed = 00:00:09 . Memory (MB): peak = 1234.211 ; gain = 303.969 ; free physical = 1091 ; free virtual = 2269
---------------------------------------------------------------------------------

Report RTL Partitions: 
+-+--------------+------------+----------+
| |RTL Partition |Replication |Instances |
+-+--------------+------------+----------+
+-+--------------+------------+----------+
---------------------------------------------------------------------------------
Start Rebuilding User Hierarchy
---------------------------------------------------------------------------------
---------------------------------------------------------------------------------
Finished Rebuilding User Hierarchy : Time (s): cpu = 00:00:09 ; elapsed = 00:00:09 . Memory (MB): peak = 1234.211 ; gain = 303.969 ; free physical = 1091 ; free virtual = 2269
---------------------------------------------------------------------------------
---------------------------------------------------------------------------------
Start Renaming Generated Ports
---------------------------------------------------------------------------------
---------------------------------------------------------------------------------
Finished Renaming Generated Ports : Time (s): cpu = 00:00:09 ; elapsed = 00:00:09 . Memory (MB): peak = 1234.211 ; gain = 303.969 ; free physical = 1091 ; free virtual = 2269
---------------------------------------------------------------------------------
---------------------------------------------------------------------------------
Start Handling Custom Attributes
---------------------------------------------------------------------------------
---------------------------------------------------------------------------------
Finished Handling Custom Attributes : Time (s): cpu = 00:00:09 ; elapsed = 00:00:09 . Memory (MB): peak = 1234.211 ; gain = 303.969 ; free physical = 1091 ; free virtual = 2269
---------------------------------------------------------------------------------
---------------------------------------------------------------------------------
Start Renaming Generated Nets
---------------------------------------------------------------------------------
---------------------------------------------------------------------------------
Finished Renaming Generated Nets : Time (s): cpu = 00:00:09 ; elapsed = 00:00:09 . Memory (MB): peak = 1234.211 ; gain = 303.969 ; free physical = 1091 ; free virtual = 2269
---------------------------------------------------------------------------------
---------------------------------------------------------------------------------
Start Writing Synthesis Report
---------------------------------------------------------------------------------

Report BlackBoxes: 
+-+--------------+----------+
| |BlackBox name |Instances |
+-+--------------+----------+
+-+--------------+----------+

Report Cell Usage: 
+------+-------+------+
|      |Cell   |Count |
+------+-------+------+
|1     |CARRY4 |     6|
|2     |LUT2   |    22|
|3     |IBUF   |    44|
|4     |OBUF   |    22|
+------+-------+------+

Report Instance Areas: 
+------+---------+-------+------+
|      |Instance |Module |Cells |
+------+---------+-------+------+
|1     |top      |       |    94|
+------+---------+-------+------+
---------------------------------------------------------------------------------
Finished Writing Synthesis Report : Time (s): cpu = 00:00:09 ; elapsed = 00:00:09 . Memory (MB): peak = 1234.211 ; gain = 303.969 ; free physical = 1091 ; free virtual = 2269
---------------------------------------------------------------------------------
Synthesis finished with 0 errors, 0 critical warnings and 1 warnings.
Synthesis Optimization Runtime : Time (s): cpu = 00:00:08 ; elapsed = 00:00:08 . Memory (MB): peak = 1234.211 ; gain = 183.723 ; free physical = 1090 ; free virtual = 2268
Synthesis Optimization Complete : Time (s): cpu = 00:00:09 ; elapsed = 00:00:09 . Memory (MB): peak = 1234.211 ; gain = 303.969 ; free physical = 1090 ; free virtual = 2268
INFO: [Project 1-571] Translating synthesized netlist
INFO: [Netlist 29-17] Analyzing 50 Unisim elements for replacement
INFO: [Netlist 29-28] Unisim Transformation completed in 0 CPU seconds
INFO: [Project 1-570] Preparing netlist for logic optimization
INFO: [Opt 31-138] Pushed 0 inverter(s) to 0 load pin(s).
INFO: [Project 1-111] Unisim Transformation Summary:
No Unisim elements were transformed.

INFO: [Common 17-83] Releasing license: Synthesis
11 Infos, 1 Warnings, 0 Critical Warnings and 0 Errors encountered.
synth_design completed successfully
synth_design: Time (s): cpu = 00:00:09 ; elapsed = 00:00:09 . Memory (MB): peak = 1304.211 ; gain = 302.633 ; free physical = 1019 ; free virtual = 2196
# opt_design
Command: opt_design
Attempting to get a license for feature 'Implementation' and/or device 'xc7z010'
INFO: [Common 17-349] Got license for feature 'Implementation' and/or device 'xc7z010'
Running DRC as a precondition to command opt_design

Starting DRC Task
INFO: [DRC 23-27] Running DRC with 4 threads
INFO: [Project 1-461] DRC finished with 0 Errors
INFO: [Project 1-462] Please refer to the DRC report (report_drc) for more information.

Time (s): cpu = 00:00:00.07 ; elapsed = 00:00:00.08 . Memory (MB): peak = 1336.227 ; gain = 32.016 ; free physical = 1019 ; free virtual = 2196
INFO: [Timing 38-35] Done setting XDC timing constraints.

Starting Logic Optimization Task
Implement Debug Cores | Checksum: 1cf48fdf2

Phase 1 Retarget
INFO: [Opt 31-138] Pushed 0 inverter(s) to 0 load pin(s).
INFO: [Opt 31-49] Retargeted 0 cell(s).
Phase 1 Retarget | Checksum: 1cf48fdf2

Time (s): cpu = 00:00:00.01 ; elapsed = 00:00:00 . Memory (MB): peak = 1678.719 ; gain = 0.000 ; free physical = 718 ; free virtual = 1895

Phase 2 Constant Propagation
INFO: [Opt 31-138] Pushed 0 inverter(s) to 0 load pin(s).
INFO: [Opt 31-10] Eliminated 0 cells.
Phase 2 Constant Propagation | Checksum: 1cf48fdf2

Time (s): cpu = 00:00:00.01 ; elapsed = 00:00:00.01 . Memory (MB): peak = 1678.719 ; gain = 0.000 ; free physical = 718 ; free virtual = 1895

Phase 3 Sweep
INFO: [Opt 31-12] Eliminated 16 unconnected nets.
INFO: [Opt 31-11] Eliminated 0 unconnected cells.
Phase 3 Sweep | Checksum: 115c7f763

Time (s): cpu = 00:00:00.02 ; elapsed = 00:00:00.01 . Memory (MB): peak = 1678.719 ; gain = 0.000 ; free physical = 718 ; free virtual = 1895

Starting Connectivity Check Task

Time (s): cpu = 00:00:00 ; elapsed = 00:00:00 . Memory (MB): peak = 1678.719 ; gain = 0.000 ; free physical = 718 ; free virtual = 1895
Ending Logic Optimization Task | Checksum: 115c7f763

Time (s): cpu = 00:00:00.02 ; elapsed = 00:00:00.02 . Memory (MB): peak = 1678.719 ; gain = 0.000 ; free physical = 718 ; free virtual = 1895

Starting Power Optimization Task
INFO: [Pwropt 34-132] Skipping clock gating for clocks with a period < 2.00 ns.
Ending Power Optimization Task | Checksum: 115c7f763

Time (s): cpu = 00:00:00.01 ; elapsed = 00:00:00 . Memory (MB): peak = 1678.719 ; gain = 0.000 ; free physical = 718 ; free virtual = 1895
INFO: [Common 17-83] Releasing license: Implementation
13 Infos, 0 Warnings, 0 Critical Warnings and 0 Errors encountered.
opt_design completed successfully
opt_design: Time (s): cpu = 00:00:09 ; elapsed = 00:00:09 . Memory (MB): peak = 1678.719 ; gain = 374.508 ; free physical = 718 ; free virtual = 1895
# place_design
Command: place_design
Attempting to get a license for feature 'Implementation' and/or device 'xc7z010'
INFO: [Common 17-349] Got license for feature 'Implementation' and/or device 'xc7z010'
INFO: [DRC 23-27] Running DRC with 4 threads
INFO: [Vivado_Tcl 4-198] DRC finished with 0 Errors
INFO: [Vivado_Tcl 4-199] Please refer to the DRC report (report_drc) for more information.
Running DRC as a precondition to command place_design
INFO: [DRC 23-27] Running DRC with 4 threads
INFO: [Vivado_Tcl 4-198] DRC finished with 0 Errors
INFO: [Vivado_Tcl 4-199] Please refer to the DRC report (report_drc) for more information.

Starting Placer Task
INFO: [Place 30-611] Multithreading enabled for place_design using a maximum of 4 CPUs

Phase 1 Placer Initialization
Netlist sorting complete. Time (s): cpu = 00:00:00 ; elapsed = 00:00:00 . Memory (MB): peak = 1710.734 ; gain = 0.000 ; free physical = 715 ; free virtual = 1892
Netlist sorting complete. Time (s): cpu = 00:00:00 ; elapsed = 00:00:00 . Memory (MB): peak = 1710.734 ; gain = 0.000 ; free physical = 715 ; free virtual = 1892

Phase 1.1 IO Placement/ Clock Placement/ Build Placer Device

Phase 1.1.1 Pre-Place Cells
Phase 1.1.1 Pre-Place Cells | Checksum: 00000000

Time (s): cpu = 00:00:00.02 ; elapsed = 00:00:00.02 . Memory (MB): peak = 1710.734 ; gain = 0.000 ; free physical = 715 ; free virtual = 1892
INFO: [Timing 38-35] Done setting XDC timing constraints.

Phase 1.1.2 IO and Clk Clean Up
Phase 1.1.2 IO and Clk Clean Up | Checksum: 00000000

Time (s): cpu = 00:00:00.50 ; elapsed = 00:00:00.33 . Memory (MB): peak = 1734.742 ; gain = 24.008 ; free physical = 713 ; free virtual = 1891

Phase 1.1.3 Implementation Feasibility check On IDelay
Phase 1.1.3 Implementation Feasibility check On IDelay | Checksum: 00000000

Time (s): cpu = 00:00:00.50 ; elapsed = 00:00:00.33 . Memory (MB): peak = 1734.742 ; gain = 24.008 ; free physical = 713 ; free virtual = 1891

Phase 1.1.4 Commit IO Placement
Phase 1.1.4 Commit IO Placement | Checksum: 3b5b0187

Time (s): cpu = 00:00:00.51 ; elapsed = 00:00:00.34 . Memory (MB): peak = 1734.742 ; gain = 24.008 ; free physical = 713 ; free virtual = 1891
Phase 1.1 IO Placement/ Clock Placement/ Build Placer Device | Checksum: 11b42dfbc

Time (s): cpu = 00:00:00.51 ; elapsed = 00:00:00.34 . Memory (MB): peak = 1734.742 ; gain = 24.008 ; free physical = 713 ; free virtual = 1891

Phase 1.2 Build Placer Netlist Model

Phase 1.2.1 Place Init Design
Phase 1.2.1 Place Init Design | Checksum: 15e6d7758

Time (s): cpu = 00:00:00.52 ; elapsed = 00:00:00.34 . Memory (MB): peak = 1734.742 ; gain = 24.008 ; free physical = 713 ; free virtual = 1891
Phase 1.2 Build Placer Netlist Model | Checksum: 15e6d7758

Time (s): cpu = 00:00:00.52 ; elapsed = 00:00:00.34 . Memory (MB): peak = 1734.742 ; gain = 24.008 ; free physical = 713 ; free virtual = 1891

Phase 1.3 Constrain Clocks/Macros

Phase 1.3.1 Constrain Global/Regional Clocks
Phase 1.3.1 Constrain Global/Regional Clocks | Checksum: 15e6d7758

Time (s): cpu = 00:00:00.52 ; elapsed = 00:00:00.35 . Memory (MB): peak = 1734.742 ; gain = 24.008 ; free physical = 713 ; free virtual = 1891
Phase 1.3 Constrain Clocks/Macros | Checksum: 15e6d7758

Time (s): cpu = 00:00:00.52 ; elapsed = 00:00:00.35 . Memory (MB): peak = 1734.742 ; gain = 24.008 ; free physical = 713 ; free virtual = 1891
Phase 1 Placer Initialization | Checksum: 15e6d7758

Time (s): cpu = 00:00:00.52 ; elapsed = 00:00:00.35 . Memory (MB): peak = 1734.742 ; gain = 24.008 ; free physical = 713 ; free virtual = 1891

Phase 2 Global Placement
Phase 2 Global Placement | Checksum: 16f64bb60

Time (s): cpu = 00:00:00.77 ; elapsed = 00:00:00.46 . Memory (MB): peak = 1766.758 ; gain = 56.023 ; free physical = 713 ; free virtual = 1891

Phase 3 Detail Placement

Phase 3.1 Commit Multi Column Macros
Phase 3.1 Commit Multi Column Macros | Checksum: 16f64bb60

Time (s): cpu = 00:00:00.78 ; elapsed = 00:00:00.46 . Memory (MB): peak = 1766.758 ; gain = 56.023 ; free physical = 713 ; free virtual = 1891

Phase 3.2 Commit Most Macros & LUTRAMs
Phase 3.2 Commit Most Macros & LUTRAMs | Checksum: 15f6b87af

Time (s): cpu = 00:00:00.80 ; elapsed = 00:00:00.47 . Memory (MB): peak = 1766.758 ; gain = 56.023 ; free physical = 713 ; free virtual = 1891

Phase 3.3 Area Swap Optimization
Phase 3.3 Area Swap Optimization | Checksum: 15f6b87af

Time (s): cpu = 00:00:00.81 ; elapsed = 00:00:00.47 . Memory (MB): peak = 1766.758 ; gain = 56.023 ; free physical = 713 ; free virtual = 1891

Phase 3.4 Small Shape Detail Placement

Phase 3.4.1 Commit Small Macros and Core Logic

Phase 3.4.1.1 Commit Slice Clusters
Phase 3.4.1.1 Commit Slice Clusters | Checksum: 15f6b87af

Time (s): cpu = 00:00:00.84 ; elapsed = 00:00:00.49 . Memory (MB): peak = 1766.758 ; gain = 56.023 ; free physical = 713 ; free virtual = 1891
Phase 3.4.1 Commit Small Macros and Core Logic | Checksum: 15f6b87af

Time (s): cpu = 00:00:00.85 ; elapsed = 00:00:00.49 . Memory (MB): peak = 1766.758 ; gain = 56.023 ; free physical = 713 ; free virtual = 1891

Phase 3.4.2 Clock Restriction Legalization for Leaf Columns
Phase 3.4.2 Clock Restriction Legalization for Leaf Columns | Checksum: 15f6b87af

Time (s): cpu = 00:00:00.86 ; elapsed = 00:00:00.50 . Memory (MB): peak = 1766.758 ; gain = 56.023 ; free physical = 713 ; free virtual = 1891

Phase 3.4.3 Clock Restriction Legalization for Non-Clock Pins
Phase 3.4.3 Clock Restriction Legalization for Non-Clock Pins | Checksum: 15f6b87af

Time (s): cpu = 00:00:00.86 ; elapsed = 00:00:00.50 . Memory (MB): peak = 1766.758 ; gain = 56.023 ; free physical = 713 ; free virtual = 1891
Phase 3.4 Small Shape Detail Placement | Checksum: 15f6b87af

Time (s): cpu = 00:00:00.86 ; elapsed = 00:00:00.50 . Memory (MB): peak = 1766.758 ; gain = 56.023 ; free physical = 713 ; free virtual = 1891

Phase 3.5 Re-assign LUT pins
Phase 3.5 Re-assign LUT pins | Checksum: 15f6b87af

Time (s): cpu = 00:00:00.86 ; elapsed = 00:00:00.50 . Memory (MB): peak = 1766.758 ; gain = 56.023 ; free physical = 713 ; free virtual = 1891
Phase 3 Detail Placement | Checksum: 15f6b87af

Time (s): cpu = 00:00:00.86 ; elapsed = 00:00:00.50 . Memory (MB): peak = 1766.758 ; gain = 56.023 ; free physical = 713 ; free virtual = 1891

Phase 4 Post Placement Optimization and Clean-Up

Phase 4.1 Post Commit Optimization
Phase 4.1 Post Commit Optimization | Checksum: 15f6b87af

Time (s): cpu = 00:00:00.87 ; elapsed = 00:00:00.51 . Memory (MB): peak = 1766.758 ; gain = 56.023 ; free physical = 713 ; free virtual = 1891

Phase 4.2 Sweep Clock Roots: Post-Placement
Phase 4.2 Sweep Clock Roots: Post-Placement | Checksum: 15f6b87af

Time (s): cpu = 00:00:00.87 ; elapsed = 00:00:00.51 . Memory (MB): peak = 1766.758 ; gain = 56.023 ; free physical = 713 ; free virtual = 1891

Phase 4.3 Post Placement Cleanup
Phase 4.3 Post Placement Cleanup | Checksum: 15f6b87af

Time (s): cpu = 00:00:00.87 ; elapsed = 00:00:00.51 . Memory (MB): peak = 1766.758 ; gain = 56.023 ; free physical = 713 ; free virtual = 1891

Phase 4.4 Placer Reporting
Phase 4.4 Placer Reporting | Checksum: 15f6b87af

Time (s): cpu = 00:00:00.87 ; elapsed = 00:00:00.51 . Memory (MB): peak = 1766.758 ; gain = 56.023 ; free physical = 713 ; free virtual = 1891

Phase 4.5 Final Placement Cleanup
Phase 4.5 Final Placement Cleanup | Checksum: 15f6b87af

Time (s): cpu = 00:00:00.88 ; elapsed = 00:00:00.51 . Memory (MB): peak = 1766.758 ; gain = 56.023 ; free physical = 713 ; free virtual = 1891
Phase 4 Post Placement Optimization and Clean-Up | Checksum: 15f6b87af

Time (s): cpu = 00:00:00.88 ; elapsed = 00:00:00.51 . Memory (MB): peak = 1766.758 ; gain = 56.023 ; free physical = 713 ; free virtual = 1891
Ending Placer Task | Checksum: 13894a3dd

Time (s): cpu = 00:00:00.88 ; elapsed = 00:00:00.51 . Memory (MB): peak = 1766.758 ; gain = 56.023 ; free physical = 713 ; free virtual = 1891
INFO: [Common 17-83] Releasing license: Implementation
10 Infos, 0 Warnings, 0 Critical Warnings and 0 Errors encountered.
place_design completed successfully
# route_design
Command: route_design
Attempting to get a license for feature 'Implementation' and/or device 'xc7z010'
INFO: [Common 17-349] Got license for feature 'Implementation' and/or device 'xc7z010'
Running DRC as a precondition to command route_design
INFO: [DRC 23-27] Running DRC with 4 threads
INFO: [Vivado_Tcl 4-198] DRC finished with 0 Errors
INFO: [Vivado_Tcl 4-199] Please refer to the DRC report (report_drc) for more information.


Starting Routing Task
INFO: [Route 35-254] Multithreading enabled for route_design using a maximum of 4 CPUs
Checksum: PlaceDB: 58acc5a8 ConstDB: 0 ShapeSum: dfe7de35 RouteDB: 0

Phase 1 Build RT Design
Phase 1 Build RT Design | Checksum: 6cc48696

Time (s): cpu = 00:00:10 ; elapsed = 00:00:09 . Memory (MB): peak = 1787.750 ; gain = 20.992 ; free physical = 646 ; free virtual = 1824

Phase 2 Router Initialization
INFO: [Route 35-64] No timing constraints were detected. The router will operate in resource-optimization mode.

Phase 2.1 Pre Route Cleanup
Phase 2.1 Pre Route Cleanup | Checksum: 6cc48696

Time (s): cpu = 00:00:10 ; elapsed = 00:00:09 . Memory (MB): peak = 1801.750 ; gain = 34.992 ; free physical = 632 ; free virtual = 1810
 Number of Nodes with overlaps = 0
Phase 2 Router Initialization | Checksum: 10f583489

Time (s): cpu = 00:00:10 ; elapsed = 00:00:09 . Memory (MB): peak = 1804.750 ; gain = 37.992 ; free physical = 629 ; free virtual = 1807

Phase 3 Initial Routing
Phase 3 Initial Routing | Checksum: 3941f41a

Time (s): cpu = 00:00:11 ; elapsed = 00:00:09 . Memory (MB): peak = 1804.750 ; gain = 37.992 ; free physical = 629 ; free virtual = 1807

Phase 4 Rip-up And Reroute

Phase 4.1 Global Iteration 0
 Number of Nodes with overlaps = 0
Phase 4.1 Global Iteration 0 | Checksum: 153caabc8

Time (s): cpu = 00:00:11 ; elapsed = 00:00:09 . Memory (MB): peak = 1804.750 ; gain = 37.992 ; free physical = 629 ; free virtual = 1807
Phase 4 Rip-up And Reroute | Checksum: 153caabc8

Time (s): cpu = 00:00:11 ; elapsed = 00:00:09 . Memory (MB): peak = 1804.750 ; gain = 37.992 ; free physical = 629 ; free virtual = 1807

Phase 5 Delay and Skew Optimization
Phase 5 Delay and Skew Optimization | Checksum: 153caabc8

Time (s): cpu = 00:00:11 ; elapsed = 00:00:09 . Memory (MB): peak = 1804.750 ; gain = 37.992 ; free physical = 629 ; free virtual = 1807

Phase 6 Post Hold Fix
Phase 6 Post Hold Fix | Checksum: 153caabc8

Time (s): cpu = 00:00:11 ; elapsed = 00:00:09 . Memory (MB): peak = 1804.750 ; gain = 37.992 ; free physical = 629 ; free virtual = 1807

Phase 7 Route finalize

Router Utilization Summary
  Global Vertical Routing Utilization    = 0.186092 %
  Global Horizontal Routing Utilization  = 0.0356158 %
  Routable Net Status*
  *Does not include unroutable nets such as driverless and loadless.
  Run report_route_status for detailed report.
  Number of Failed Nets               = 0
  Number of Unrouted Nets             = 0
  Number of Partially Routed Nets     = 0
  Number of Node Overlaps             = 0

Congestion Report
North Dir 1x1 Area, Max Cong = 16.2162%, No Congested Regions.
South Dir 1x1 Area, Max Cong = 23.4234%, No Congested Regions.
East Dir 1x1 Area, Max Cong = 8.82353%, No Congested Regions.
West Dir 1x1 Area, Max Cong = 8.82353%, No Congested Regions.
Phase 7 Route finalize | Checksum: 153caabc8

Time (s): cpu = 00:00:11 ; elapsed = 00:00:09 . Memory (MB): peak = 1804.750 ; gain = 37.992 ; free physical = 629 ; free virtual = 1807

Phase 8 Verifying routed nets

 Verification completed successfully
Phase 8 Verifying routed nets | Checksum: 153caabc8

Time (s): cpu = 00:00:11 ; elapsed = 00:00:09 . Memory (MB): peak = 1806.750 ; gain = 39.992 ; free physical = 627 ; free virtual = 1804

Phase 9 Depositing Routes
Phase 9 Depositing Routes | Checksum: 1057ba428

Time (s): cpu = 00:00:11 ; elapsed = 00:00:09 . Memory (MB): peak = 1806.750 ; gain = 39.992 ; free physical = 627 ; free virtual = 1804
INFO: [Route 35-16] Router Completed Successfully

Time (s): cpu = 00:00:11 ; elapsed = 00:00:09 . Memory (MB): peak = 1806.750 ; gain = 39.992 ; free physical = 627 ; free virtual = 1804

Routing Is Done.
INFO: [Common 17-83] Releasing license: Implementation
8 Infos, 0 Warnings, 0 Critical Warnings and 0 Errors encountered.
route_design completed successfully
route_design: Time (s): cpu = 00:00:11 ; elapsed = 00:00:09 . Memory (MB): peak = 1806.848 ; gain = 40.090 ; free physical = 627 ; free virtual = 1804
# report_utilization -file ./reports/area/22bit_adder_util.rpt
report_utilization: Time (s): cpu = 00:00:00.01 ; elapsed = 00:00:00.05 . Memory (MB): peak = 1806.848 ; gain = 0.000 ; free physical = 625 ; free virtual = 1802
# report_power -file ./reports/power/22bit_adder_power.rpt
WARNING: [Power 33-232] No user defined clocks were found in the design!
Resolution: Please specify clocks using create_clock/create_generated_clock for sequential elements. For pure combinatorial circuits, please specify a virtual clock, otherwise the vectorless estimation might be inaccurate
Running Vector-less Activity Propagation...

Finished Running Vector-less Activity Propagation
# report_timing -file ./reports/timing/22bit_adder_timing.rpt
INFO: [Timing 38-91] UpdateTimingParams: Speed grade: -1, Delay Type: max.
INFO: [Timing 38-191] Multithreading enabled for timing update using a maximum of 4 CPUs
INFO: [Timing 38-78] ReportTimingParams: -max_paths 1 -nworst 1 -delay_type max -sort_by slack.
# exit
INFO: [Common 17-206] Exiting Vivado at Sat Apr 23 21:36:45 2016...
